"Key","Item Type","Publication Year","Author","Title","Publication Title","ISBN","ISSN","DOI","Url","Abstract Note","Date","Date Added","Date Modified","Access Date","Pages","Num Pages","Issue","Volume","Number Of Volumes","Journal Abbreviation","Short Title","Series","Series Number","Series Text","Series Title","Publisher","Place","Language","Rights","Type","Archive","Archive Location","Library Catalog","Call Number","Extra","Notes","File Attachments","Link Attachments","Manual Tags","Automatic Tags","Editor","Series Editor","Translator","Contributor","Attorney Agent","Book Author","Cast Member","Commenter","Composer","Cosponsor","Counsel","Interviewer","Producer","Recipient","Reviewed Author","Scriptwriter","Words By","Guest","Number","Edition","Running Time","Scale","Medium","Artwork Size","Filing Date","Application Number","Assignee","Issuing Authority","Country","Meeting Name","Conference Name","Court","References","Reporter","Legal Status","Priority Numbers","Programming Language","Version","System","Code","Code Number","Section","Session","Committee","History","Legislative Body"
"RWPTX93X","journalArticle","2020","R. Etengu; S. C. Tan; L. C. Kwang; F. M. Abbou; T. C. Chuah","AI-Assisted Framework for Green-Routing and Load Balancing in Hybrid Software-Defined Networking: Proposal, Challenges and Future Perspective","IEEE Access","","2169-3536","10.1109/ACCESS.2020.3022291","","The explosive growth of IP networks, the advent of cloud computing, and the rapid progress in wireless communications witnessed today reflect significant progress towards meeting the explosive data traffic demands. Consequently, communications service providers should deploy efficient and intelligent network solutions to accommodate the huge traffic demands and to ease the capacity pressure on their network infrastructure. Besides, vendors should develop novel energy-efficient networks to reduce network utility costs and carbon footprint. Software-defined networking (SDN) provides a suitable solution, however, complete SDN deployment is currently unachievable in the short-term. An alternative is the hybrid SDN/open shortest path forwarding (OSPF) network, which allows the deployment of SDN in legacy networks. Nevertheless, hybrid SDN/OSPF also faces several technical, economic and organizational challenges. Although many energy-efficiency routing solutions exist in hybrid SDN/OSPF networks, they are generic and reactive by design. Moreover, these solutions are characterized by manual control plane forwarding configurations, leading to sub-optimal performance. The recent promising combination of SDN and artificial intelligence (AI) techniques such as machine learning (ML) and deep learning (DL) in traffic management and control provides tremendous opportunities. In this paper, we first provide a review of the most recent optimization approaches for global energy-efficient routing and load balancing. Next, we investigate a scalable and intelligent integrated architectural framework that leverages deep reinforcement learning (DRL) techniques to realize predictive and rate adaptive energy-efficient routing with guaranteed quality of service (QoS), in transitional hybrid SDN/OSPF networks. Based on the need to minimize global network energy consumption and improve link performance, this paper provides key research insights into the current progress in hybrid SDN/OSPF, ML and AI in the hope of stimulating more research.","2020","2025-07-09 04:16:11","2025-07-11 08:11:15","","166384-166441","","","8","","IEEE Access","","","","","","","","","","","","","","","","","","","artificial intelligence; Communication networks; deep reinforcement learning; energy-aware routing; Heuristic algorithms; Hybrid SDN/OSPF; Load management; machine learning; Machine learning; Optimization; quality of service; Quality of service; Routing; scalable; traffic engineering","","","","","","","","","","","","","","","","","","","","","","","","","","","","","","","","","","","","","","","","","","","","","","",""
"ICEHICCJ","journalArticle","2018","M. V. O. De Assis; M. P. Novaes; C. B. Zerbini; L. F. Carvalho; T. Abrãao; M. L. Proença","Fast Defense System Against Attacks in Software Defined Networks","IEEE Access","","2169-3536","10.1109/ACCESS.2018.2878576","","With the ever-growing data traffic in computer networks nowadays, the management of large-scale networks is a challenge for guaranteeing the quality of the provided services. This is due to the increasingly usage of connected applications, such as Internet of Things and cloud computing environments. Software-defined networking (SDN) is a new paradigm that aims to make this management process easier by centralizing the configuration of all network devices into a single programmable central controller. However, as any centralized service, this architecture is susceptible to security vulnerabilities, such as distributed denial of service (DDoS) and port scan attacks. Thus, security methods are necessary to guarantee the normal operation of SDN's central controller. Furthermore, networks are transporting an increasingly amount of information day by day, which could mean data loss in case of long network unavailability. For this reason, security mechanisms must operate online, with fast-responding countermeasures to mitigate the impact of the detected attacks over the SDN. In this paper, we present a fast SDN defense system against DDoS and port scan attacks, which runs directly into the central controller and uses a game theoretical approach for attack mitigation. For the detection, we compare three different approaches, particle swarm optimization, multi-layer perceptron neural network, and discrete wavelet transform. We test our approach over IP flow data generated over Mininet network emulator, along with floodlight controller, and the presented defense system achieved good outcomes for both detection and mitigation processes.","2018","2025-07-09 04:16:11","2025-07-11 08:11:14","","69620-69639","","","6","","IEEE Access","","","","","","","","","","","","","","","","","","","Anomaly detection; Computer crime; DDoS; Discrete wavelet transforms; DWT; Internet of Things; IP networks; MLP; port scan; PSO; SDN; Software","","","","","","","","","","","","","","","","","","","","","","","","","","","","","","","","","","","","","","","","","","","","","","",""
"VQR692ZR","journalArticle","2017","M. V. O. De Assis; A. H. Hamamoto; T. Abrão; M. L. Proença","A Game Theoretical Based System Using Holt-Winters and Genetic Algorithm With Fuzzy Logic for DoS/DDoS Mitigation on SDN Networks","IEEE Access","","2169-3536","10.1109/ACCESS.2017.2702341","","The ever expanding the usage of cloud computing environments, connected applications and Internet of Things-based devices have progressively increased the amount of data that travels through our networks. Software-defined network (SDN) is an emergent paradigm that aims to support next-generation networks through its flexible and powerful management mechanisms. One of the biggest threats faced by these services nowadays is security management. Attacks based on the denial of service (DoS) are particularly efficient against this paradigm due to its centralized control characteristic. Once this controlling system receives a massive amount of malicious requests, the overall performance of the network operation is impaired. Although several researches propose to address this problem, most of them are reactive approaches, detecting the attacks and warning the network administrators, i.e., after the network is already compromised. This paper presents an autonomic DoS/DDoS defensive approach for SDNs called Game Theory (GT)-Holt-Winters for Digital Signature (HWDS), which unites the anomaly detection and identification provided by an HWDS system with an autonomous decision-making model based on GT. Real collected data and simulated attacks are used by the system to measure its effectiveness and efficiency. Furthermore, we also use a heuristic Fuzzy-GADS method for anomaly detection instead of HWDS, aiming to compare the achieved performance and evaluate the behavior of the presented game theoretical approaches a standalone mitigation module.","2017","2025-07-09 04:16:11","2025-07-11 08:11:13","","9485-9496","","","5","","IEEE Access","","","","","","","","","","","","","","","","","","","Computer crime; denial of service; fuzzy logic; Fuzzy logic; GADS; Game theory; Games; Genetic algorithms; HWDS; IP networks","","","","","","","","","","","","","","","","","","","","","","","","","","","","","","","","","","","","","","","","","","","","","","",""
"IVXSZASC","journalArticle","2018","","2018 Index IEEE Journal of Selected Topics in Signal Processing Vol. 12","IEEE Journal of Selected Topics in Signal Processing","","1941-0484","10.1109/JSTSP.2018.2886649","","This index covers all technical items - papers, correspondence, reviews, etc. - that appeared in this periodical during the year, and items from previous years that were commented upon or corrected in this year. Departments and other items may also be covered if they have been judged to have archival value. The Author Index contains the primary entry for each item, listed under the first author's name. The primary entry includes the co-authors' names, the title of the paper or other item, and its location, specified by the publication abbreviation, year, month, and inclusive pagination. The Subject Index contains entries describing the item under all appropriate subject headings, plus the first author's name, the publication abbreviation, month, and year, and inclusive pages. Note that the item title is found only under the primary entry in the Author Index.","2018-12","2025-07-09 04:16:12","2025-07-11 08:11:21","","1638-1656","","6","12","","IEEE Journal of Selected Topics in Signal Processing","","","","","","","","","","","","","","","","","","","","","","","","","","","","","","","","","","","","","","","","","","","","","","","","","","","","","","","","","","","","","","","","","",""
"GPJ37T9X","conferencePaper","2020","","Table of Contents","2020 IEEE Intl Conf on Parallel & Distributed Processing with Applications, Big Data & Cloud Computing, Sustainable Computing & Communications, Social Computing & Networking (ISPA/BDCloud/SocialCom/SustainCom)","","","10.1109/ISPA-BDCloud-SocialCom-SustainCom51426.2020.00004","","Presents the table of contents/splash page of the proceedings record.","2020-12-17","2025-07-09 04:16:12","2025-07-11 08:11:25","","v-xxxiv","","","","","","","","","","","","","","","","","","","","Journal Abbreviation: 2020 IEEE Intl Conf on Parallel & Distributed Processing with Applications, Big Data & Cloud Computing, Sustainable Computing & Communications, Social Computing & Networking (ISPA/BDCloud/SocialCom/SustainCom)","","","","","","","","","","","","","","","","","","","","","","","","","","","","","","","","","","","","2020 IEEE Intl Conf on Parallel & Distributed Processing with Applications, Big Data & Cloud Computing, Sustainable Computing & Communications, Social Computing & Networking (ISPA/BDCloud/SocialCom/SustainCom)","","","","","","","","","","","","","","",""
"LV47RP6Y","conferencePaper","2018","","ICCCA 2018 Paper Presentation","2018 4th International Conference on Computing Communication and Automation (ICCCA)","2642-7354","","10.1109/CCAA.2018.8777625","","Conference proceedings front matter may contain various advertisements, welcome messages, committee or program information, and other miscellaneous conference information. This may in some cases also include the cover art, table of contents, copyright sta","2018-12-14","2025-07-09 04:16:12","2025-07-11 08:11:23","","i-xv","","","","","","","","","","","","","","","","","","","","Journal Abbreviation: 2018 4th International Conference on Computing Communication and Automation (ICCCA)","","","","","","","","","","","","","","","","","","","","","","","","","","","","","","","","","","","","2018 4th International Conference on Computing Communication and Automation (ICCCA)","","","","","","","","","","","","","","",""
"4EMRL6KA","conferencePaper","2018","","Table of contents","2018 IEEE International Conference on Mechatronics and Automation (ICMA)","2152-744X","","10.1109/ICMA.2018.8484738","","Presents the table of contents/splash page of the proceedings record.","2018-08-05","2025-07-09 04:16:12","2025-07-11 08:11:20","","1-35","","","","","","","","","","","","","","","","","","","","Journal Abbreviation: 2018 IEEE International Conference on Mechatronics and Automation (ICMA)","","","","","","","","","","","","","","","","","","","","","","","","","","","","","","","","","","","","2018 IEEE International Conference on Mechatronics and Automation (ICMA)","","","","","","","","","","","","","","",""
"Y2BTI9JS","journalArticle","2018","","2018 Index IEEE Transactions on Power Delivery Vol. 33","IEEE Transactions on Power Delivery","","1937-4208","10.1109/TPWRD.2018.2890521","","Presents the 2018 subject/author index for this publication.","2018-12","2025-07-09 04:16:12","2025-07-11 08:11:22","","3271-3325","","6","33","","IEEE Transactions on Power Delivery","","","","","","","","","","","","","","","","","","","","","","","","","","","","","","","","","","","","","","","","","","","","","","","","","","","","","","","","","","","","","","","","","",""
"SSEEHARH","conferencePaper","2020","","Final Program","2020 International Conference on Unmanned Aircraft Systems (ICUAS)","2575-7296","","10.1109/ICUAS48674.2020.9214039","","Provides a schedule of conference events and a listing of which papers were presented in each session.","2020-09-01","2025-07-09 04:16:12","2025-07-11 08:11:24","","i-cxxvi","","","","","","","","","","","","","","","","","","","","Journal Abbreviation: 2020 International Conference on Unmanned Aircraft Systems (ICUAS)","","","","","","","","","","","","","","","","","","","","","","","","","","","","","","","","","","","","2020 International Conference on Unmanned Aircraft Systems (ICUAS)","","","","","","","","","","","","","","",""
"EPLXDGXW","journalArticle","2024","B. Van Herbruggen; J. V. -V. Gerwen; S. Luchie; Y. Durodié; B. Vanderborght; M. Aernouts; A. Munteanu; J. Fontaine; E. D. Poorter","Selecting and Combining UWB Localization Algorithms: Insights and Recommendations From a Multi-Metric Benchmark","IEEE Access","","2169-3536","10.1109/ACCESS.2024.3358274","","Ultra-wideband (UWB) localization has emerged in GPS-denied environments as a crucial facilitator for diverse industries, including logistics, healthcare applications, and societal domains. Despite notable progress, UWB algorithms from the scientific literature are often evaluated in isolation in very specific conditions and hence difficult to compare. This paper introduces a novel benchmark platform designed to assess the performance of 11 prominent UWB accuracy-enhancing algorithms, both independently and in combination. A key feature of the platform is its incorporation of multiple diverse evaluation metrics, including mean average error, latency, and spatial error. We showcase the significance of adopting alternative metrics such as spatial error, which often, depending on the use case, offers greater relevance than the prevalently used mean average error. Furthermore, we show that “more is better” does not hold true when combining multiple accuracy-improving algorithms for UWB systems: combining multiple accuracy-improving algorithms reveals instances of diminishing returns and can even result in overall performance decline. Additionally, we caution against blind reliance on accuracy outcomes reported in the scientific literature when designing UWB systems for use cases that are different in terms of requirements or environment. Finally, we also provide algorithmic recommendations for distinct surroundings, exemplary applications, and usage contexts, assisting in driving efficient design in future UWB research and adoption.","2024","2025-07-09 04:18:06","2025-07-11 08:11:11","","16881-16901","","","12","","IEEE Access","","","","","","","","","","","","","","","","","","","Benchmark; Benchmark testing; filters; Global Positioning System; guidelines; Guidelines; localization; Location awareness; LOS/NLOS; software; Ultra wideband technology; ultra-wideband; UWB","","","","","","","","","","","","","","","","","","","","","","","","","","","","","","","","","","","","","","","","","","","","","","",""
"U7YRMUXM","journalArticle","2022","U. Farooq; R. B. Bass","Frequency Event Detection and Mitigation in Power Systems: A Systematic Literature Review","IEEE Access","","2169-3536","10.1109/ACCESS.2022.3180349","","Modern power systems characterized by complex topologies require accurate situational awareness to maintain an adequate level of reliability. Since they are large and spread over wide geographical areas, it is inevitable that failures will occur. Various generation and transmission disturbances, such as generator and transmission line tripping and load disconnection, give rise to a mismatch between generation and demand, which manifest as frequency events. These events can take the form of negligible frequency deviations or more severe emergencies that can precipitate cascading outages, depending on the severity of the disturbance and efficacy of remedial action schema. The impacts of such events have become more critical recently due to increased levels of renewable penetration and distributed energy resources, which have caused a decline in system synchronous inertia. Due to the repercussions, it is indispensable to arrest such disturbances on time by activating primary frequency control measures. In this paper, a comprehensive systematic literature review is presented on the techniques used for event detection in power systems and the methods of primary frequency response in modern power systems. The paper also highlights the impacts of severe frequency events within power systems.","2022","2025-07-09 04:18:07","2025-07-11 08:11:18","","61494-61519","","","10","","IEEE Access","","","","","","","","","","","","","","","","","","","event detection; Event detection; frequency control; Frequency control; Frequency measurement; low inertia power systems; power blackouts; Power system disturbance; Power system dynamics; Power systems; Reliability; systematic literature review; Systematics","","","","","","","","","","","","","","","","","","","","","","","","","","","","","","","","","","","","","","","","","","","","","","",""
"N348928H","journalArticle","2022","S. Özyurt; A. F. Coşkun; S. Büyükçorak; G. Karabulut Kurt; O. Kucur","A Survey on Multiuser SWIPT Communications for 5G+","IEEE Access","","2169-3536","10.1109/ACCESS.2022.3212774","","Increasing number of devices connected to the networks, applications and demands of new generation wireless communications cause very high energy consumption resulting in large amount of carbon emission. Thus, energy harvesting solutions together with accomplishing information transmission are required for energy efficient communications of new wireless communications generations such as 5G and 6G (i.e., 5G+). As such, due to the promise of energy efficient green communications, simultaneous wireless information and power transfer (SWIPT) techniques are expected to be indispensable component of 5G+. In this survey, the literature of multiuser SWIPT communications is reviewed for 5G+. Different multiuser SWIPT scenarios including multi-antenna communications, cooperative communications, network coding, communications security, and unmanned aerial vehicle (UAV)-enabled communication systems based on multiuser diversity and multiple access methods are thoroughly reviewed. The experimental studies are also discussed.","2022","2025-07-09 04:18:07","2025-07-11 08:11:17","","109814-109849","","","10","","IEEE Access","","","","","","","","","","","","","","","","","","","5G mobile communication; 6G mobile communication; Autonomous aerial vehicles; cooperative; Energy harvesting; MIMO; MIMO communication; multiple access; multiuser; multiuser diversity; Radio frequency; Receiving antennas; Relays; Simultaneous wireless information and power transfer; SWIPT; Switches; UAV; Wireless communication; Wireless sensor networks","","","","","","","","","","","","","","","","","","","","","","","","","","","","","","","","","","","","","","","","","","","","","","",""
"F4WZEQWJ","journalArticle","2024","S. M. Alqhtani; T. A. Soomro; A. Ali Shah; A. Aziz Memon; M. Irfan; S. Rahman; M. Jalalah; A. H. M. Almawgani; L. A. Bade Eljak","Improved Brain Tumor Segmentation and Classification in Brain MRI With FCM-SVM: A Diagnostic Approach","IEEE Access","","2169-3536","10.1109/ACCESS.2024.3394541","","Cancer associated with the nervous system and brain tumors ranks among the leading causes of death in various countries. Magnetic resonance imaging (MRI) and computed tomography (CT) capture brain images. MRI is pivotal in diagnosing brain tumors and analyzing other brain disorders. Typically, radiologists or experts manually assess MRI images to detect brain tumors and abnormalities in the early stages for appropriate treatment. However, early brain tumor diagnosis is complex, necessitating computerized methods. This research introduces a novel approach for the automated segmentation of brain tumors and a framework for classifying brain tumor regions. The proposed methods comprise several stages: preprocessing, enhancing the coherence of MRI brain images using Contrast Limited Adaptive Histogram Equalization (CLAHE) and diffusion filtering in the first two steps, followed by the segmentation of the region of interest using the Fuzzy C-Means (FCM) clustering technique in the third step. The last step involves classification using the Support Vector Machine (SVM) classifier. The classifier is applied to different brain tumor types, from meningioma to pituitary tumors, utilizing the CE-MRI database. The proposed method exhibits significantly improved contrast and proves the effectiveness of the classification framework, achieving an average sensitivity of 0.977, specificity of 0.979, accuracy of 0.982, and a Dice score (DSC) of 0.961. Furthermore, this method demonstrates a shorter processing time of 0.42 seconds compared to existing approaches. The performance of this method underscores its significance when compared to state-of-the-art methods in terms of sensitivity, specificity, accuracy, and DSC. For future enhancements, it is possible to standardize the approach by incorporating a set of classifiers to increase the robustness of the brain classification method.","2024","2025-07-09 04:18:07","2025-07-11 08:11:16","","61312-61335","","","12","","IEEE Access","","","","","","","","","","","","","","","","","","","Brain; Brain tumor; classification; Computed tomography; contrast limited adaptive histogram equalization; diffusion filtering; Fuzzy C-Means; Image segmentation; Magnetic resonance imaging; Pipelines; segmentation; support vector machine; Support vector machines; Tumors","","","","","","","","","","","","","","","","","","","","","","","","","","","","","","","","","","","","","","","","","","","","","","",""
"9L27DYNU","journalArticle","2023","T. J. Lucas; I. S. de Figueiredo; C. A. C. Tojeiro; A. M. G. de Almeida; R. Scherer; J. R. F. Brega; J. P. Papa; K. A. P. da Costa","A Comprehensive Survey on Ensemble Learning-Based Intrusion Detection Approaches in Computer Networks","IEEE Access","","2169-3536","10.1109/ACCESS.2023.3328535","","Machine learning algorithms present a robust alternative for building Intrusion Detection Systems due to their ability to recognize attacks in computer network traffic by recognizing patterns in large amounts of data. Typically, classifiers are trained for this task. Together, ensemble learning algorithms have increased the performance of these detectors, reducing classification errors and allowing computer networks to be more protected. This research presents a comprehensive Systematic Review of the Literature where works related to intrusion detection with ensemble learning were obtained from the most relevant scientific bases. We offer 188 works, several compilations of datasets, classifiers, and ensemble algorithms, and document the experiments that stood out in their performance. A characteristic of this research is its originality. We found two surveys in the literature specifically focusing on the relationship between ensemble techniques and intrusion detection. We present for the last eight years covered by this survey a timeline-based view of the works studied to highlight evolutions and trends. The results obtained by our survey show a growing area, with excellent results in detecting attacks but with needs for improvement in pruning for choosing classifiers, which makes this work unprecedented for this context.","2023","2025-07-09 04:18:07","2025-07-11 08:11:18","","122638-122676","","","11","","IEEE Access","","","","","","","","","","","","","","","","","","","Bagging; Computer networks; Computer security; Cybersecurity; ensemble learning; Ensemble learning; Intrusion detection; intrusion detection systems; machine learning; Machine learning; Protocols; Random forests; Surveys","","","","","","","","","","","","","","","","","","","","","","","","","","","","","","","","","","","","","","","","","","","","","","",""
