Item Title,Publication Title,Book Series Title,Journal Volume,Journal Issue,Item DOI,Authors,Publication Year,URL,Content Type
Optimization methodology assessment for the inlet velocity profile of a hydraulic turbine draft tube: part II—performance evaluation of draft tube model,Journal of Global Optimization,,,,10.1007/s10898-012-0011-4,Galván SergioRubio CarlosJesús PachecoSolorio GildardoCarbajal Georgina,2012,https://link.springer.com/article/10.1007/s10898-012-0011-4,Article
Remote sensing contributing to assess earthquake risk: from a literature review towards a roadmap,Natural Hazards,,,,10.1007/s11069-012-0322-2,Christian GeißHannes Taubenböck,2012,https://link.springer.com/article/10.1007/s11069-012-0322-2,Article
CORAMOD: a checklist-oriented model-based requirements analysis approach,Requirements Engineering,,,,10.1007/s00766-012-0154-3,William BraceKalevi Ekman,2012,https://link.springer.com/article/10.1007/s00766-012-0154-3,Article
Embedded programming and real-time signal processing of swimming strokes,Sports Engineering,,,,10.1007/s12283-011-0070-7,T. Le SageA. BindelP. P. ConwayL. M. JusthamS. E. SlawsonA. A. West,2011,https://link.springer.com/article/10.1007/s12283-011-0070-7,Article
Measuring the Quality of Life and the Construction of Social Indicators,Handbook of Social Indicators and Quality of Life Research,,,,10.1007/978-94-007-2421-1_10,Filomena MagginoBruno D. Zumbo,2012,https://link.springer.com/chapter/10.1007/978-94-007-2421-1_10,Chapter
Numerical analysis of the Nanjing Dashengguan Yangtze River Bridge subjected to non-uniform seismic excitations,Journal of Mechanical Science and Technology,,,,10.1007/s12206-011-0230-5,Chaoyi XiaTieyi Zhong,2011,https://link.springer.com/article/10.1007/s12206-011-0230-5,Article
Planetary rovers’ wheel–soil interaction mechanics: new challenges and applications for wheeled mobile robots,Intelligent Service Robotics,,,,10.1007/s11370-010-0080-5,Liang DingZongquan DengHaibo GaoKeiji NagataniKazuya Yoshida,2010,https://link.springer.com/article/10.1007/s11370-010-0080-5,Article